{
  "protocol": "longarc.protocol.effect-observation.v0",
  "effectId": "effect.example.counter.0001",
  "authorization": {
    "status": "allowed",
    "authorityRef": "grant.example.counter.0001"
  },
  "attempt": {
    "status": "finished",
    "attemptId": "attempt.example.counter.0001"
  },
  "observation": {
    "status": "unavailable",
    "effectTruth": "unknown"
  },
  "completion": {
    "status": "indeterminate"
  },
  "retry": {
    "allowed": false,
    "reason": "manual_review_required"
  }
}
